{
    "0": {
        "only_prompt": {
            "goal_achieved": true,
            "content": "I am playing with a set of blocks where I need to arrange the blocks into stacks. Here are the actions I can do\n\nPick up a block\nUnstack a block from on top of another block\nPut down a block\nStack a block on top of another block\n\nI have the following restrictions on my actions:\nI can only pick up or unstack one block at a time.\nI can only pick up or unstack a block if my hand is empty.\nI can only pick up a block if the block is on the table and the block is clear. A block is clear if the block has no other blocks on top of it and if the block is not picked up.\nI can only unstack a block from on top of another block if the block I am unstacking was really on top of the other block.\nI can only unstack a block from on top of another block if the block I am unstacking is clear.\nOnce I pick up or unstack a block, I am holding the block.\nI can only put down a block that I am holding.\nI can only stack a block on top of another block if I am holding the block being stacked.\nI can only stack a block on top of another block if the block onto which I am stacking the block is clear.\nOnce I put down or stack a block, my hand becomes empty.\nOnce you stack a block on top of a second block, the second block is no longer clear.\n\n[STATEMENT]\nAs initial conditions I have that, the orange block is clear, the hand is empty, the red block is on top of the blue block, the orange block is on top of the red block and the blue block is on the table.\nMy goal is to have that the blue block is on top of the red block and the orange block is on top of the blue block.\n\nMy plan is as follows:\n\n[PLAN]\nunstack the orange block from on top of the red block\nput down the orange block\nunstack the red block from on top of the blue block\nput down the red block\npick up the blue block\nstack the blue block on top of the red block\npick up the orange block\nstack the orange block on top of the blue block\n[PLAN END]\n\n[STATEMENT]\nAs initial conditions I have that, the blue block is clear, the orange block is clear, the hand is empty, the blue block is on top of the red block, the red block is on the table and the orange block is on the table.\nMy goal is to have that the red block is on top of the blue block and the orange block is on top of the red block.\n\nMy plan is as follows:\n\n[PLAN]pick up the blue block\nunstack the blue block from on top of the red block\nput down the blue block\npick up the red block\nstack the red block on top of the blue block\npick up the orange block\nstack the orange block on top of the red block",
            "actions": {
                "0": [
                    "pick up the blue block",
                    false
                ],
                "1": [
                    "unstack the blue block from on top of the red block",
                    true
                ],
                "2": [
                    "put down the blue block",
                    true
                ],
                "3": [
                    "pick up the red block",
                    true
                ],
                "4": [
                    "stack the red block on top of the blue block",
                    true
                ],
                "5": [
                    "pick up the orange block",
                    true
                ],
                "6": [
                    "stack the orange block on top of the red block",
                    true
                ]
            }
        },
        "chat": {
            "goal_achieved": true,
            "content": "human: I am playing with a set of blocks where I need to arrange the blocks into stacks. Here are the actions I can do\n\nPick up a block\nUnstack a block from on top of another block\nPut down a block\nStack a block on top of another block\n\nI have the following restrictions on my actions:\nI can only pick up or unstack one block at a time.\nI can only pick up or unstack a block if my hand is empty.\nI can only pick up a block if the block is on the table and the block is clear. A block is clear if the block has no other blocks on top of it and if the block is not picked up.\nI can only unstack a block from on top of another block if the block I am unstacking was really on top of the other block.\nI can only unstack a block from on top of another block if the block I am unstacking is clear.\nOnce I pick up or unstack a block, I am holding the block.\nI can only put down a block that I am holding.\nI can only stack a block on top of another block if I am holding the block being stacked.\nI can only stack a block on top of another block if the block onto which I am stacking the block is clear.\nOnce I put down or stack a block, my hand becomes empty.\nOnce you stack a block on top of a second block, the second block is no longer clear.\n[STATEMENT]\nAs initial conditions I have that, the blue block is clear, the orange block is clear, the hand is empty, the blue block is on top of the red block, the red block is on the table and the orange block is on the table.\nMy goal is to have that the red block is on top of the blue block and the orange block is on top of the red block.\n\nReturn the first action I need to take to achieve my goal. Return one, and only one, action, without nothing more.\npick up the orange block\nhuman: Good action! Return the next action to achieve my goal. Return one, and only one, action, without nothing more.\nput down the orange block\nhuman: Good action! Return the next action to achieve my goal. Return one, and only one, action, without nothing more.\npick up the blue block\nhuman: This action is not possible due to the set of restrictions. Return one action that is allowed by the set of restrictions. Return one, and only one, action, without nothing more.\nunstack the blue block from on top of the red block\nhuman: Good action! Return the next action to achieve my goal. Return one, and only one, action, without nothing more.\nput down the blue block\nhuman: Good action! Return the next action to achieve my goal. Return one, and only one, action, without nothing more.\npick up the red block\nhuman: Good action! Return the next action to achieve my goal. Return one, and only one, action, without nothing more.\npick up the blue block\nhuman: This action is not possible due to the set of restrictions. Return one action that is allowed by the set of restrictions. Return one, and only one, action, without nothing more.\nunstack the orange block from on top of the red block\nhuman: This action is not possible due to the set of restrictions. Return one action that is allowed by the set of restrictions. Return one, and only one, action, without nothing more.\nstack the red block on top of the blue block\nhuman: Good action! Return the next action to achieve my goal. Return one, and only one, action, without nothing more.\npick up the orange block\nhuman: Good action! Return the next action to achieve my goal. Return one, and only one, action, without nothing more.\nstack the orange block on top of the red block\n\n[STATEMENT]\nAs initial conditions I have that, the blue block is clear, the orange block is clear, the hand is empty, the blue block is on top of the red block, the red block is on the table and the orange block is on the table.\nMy goal is to have that the red block is on top of the blue block and the orange block is on top of the red block.\n\nReturn the first action I need to take to achieve my goal. Return one, and only one, action, without nothing more.\n\nai: unstack the blue block from on top of the red block\nhuman: Good action! Return the next action to achieve my goal. Return one, and only one, action, without nothing more.\n\nai: put down the blue block\nhuman: Good action! Return the next action to achieve my goal. Return one, and only one, action, without nothing more.\n\nai: pick up the red block\nhuman: Good action! Return the next action to achieve my goal. Return one, and only one, action, without nothing more.\n\nai: stack the red block on top of the blue block\nhuman: Good action! Return the next action to achieve my goal. Return one, and only one, action, without nothing more.\n\nai: pick up the orange block\nhuman: Good action! Return the next action to achieve my goal. Return one, and only one, action, without nothing more.\n\nai: stack the orange block on top of the red block",
            "actions": {
                "0": [
                    "unstack the blue block from on top of the red block",
                    true
                ],
                "1": [
                    "put down the blue block",
                    true
                ],
                "2": [
                    "pick up the red block",
                    true
                ],
                "3": [
                    "stack the red block on top of the blue block",
                    true
                ],
                "4": [
                    "pick up the orange block",
                    true
                ],
                "5": [
                    "stack the orange block on top of the red block",
                    true
                ]
            }
        }
    },
    "1": {
        "only_prompt": {
            "goal_achieved": true,
            "content": "I am playing with a set of blocks where I need to arrange the blocks into stacks. Here are the actions I can do\n\nPick up a block\nUnstack a block from on top of another block\nPut down a block\nStack a block on top of another block\n\nI have the following restrictions on my actions:\nI can only pick up or unstack one block at a time.\nI can only pick up or unstack a block if my hand is empty.\nI can only pick up a block if the block is on the table and the block is clear. A block is clear if the block has no other blocks on top of it and if the block is not picked up.\nI can only unstack a block from on top of another block if the block I am unstacking was really on top of the other block.\nI can only unstack a block from on top of another block if the block I am unstacking is clear.\nOnce I pick up or unstack a block, I am holding the block.\nI can only put down a block that I am holding.\nI can only stack a block on top of another block if I am holding the block being stacked.\nI can only stack a block on top of another block if the block onto which I am stacking the block is clear.\nOnce I put down or stack a block, my hand becomes empty.\nOnce you stack a block on top of a second block, the second block is no longer clear.\n\n[STATEMENT]\nAs initial conditions I have that, the blue block is clear, the orange block is clear, the hand is empty, the blue block is on top of the red block, the red block is on the table and the orange block is on the table.\nMy goal is to have that the red block is on top of the blue block and the orange block is on top of the red block.\n\nMy plan is as follows:\n\n[PLAN]\nunstack the blue block from on top of the red block\nput down the blue block\npick up the red block\nstack the red block on top of the blue block\npick up the orange block\nstack the orange block on top of the red block\n[PLAN END]\n\n[STATEMENT]\nAs initial conditions I have that, the blue block is clear, the orange block is clear, the hand is empty, the blue block is on top of the red block, the red block is on the table and the orange block is on the table.\nMy goal is to have that the blue block is on top of the orange block and the orange block is on top of the red block.\n\nMy plan is as follows:\n\n[PLAN]unstack the blue block from on top of the red block\nput down the blue block\npick up the orange block\nstack the orange block on top of the red block\npick up the blue block\nstack the blue block on top of the orange block",
            "actions": {
                "0": [
                    "unstack the blue block from on top of the red block",
                    true
                ],
                "1": [
                    "put down the blue block",
                    true
                ],
                "2": [
                    "pick up the orange block",
                    true
                ],
                "3": [
                    "stack the orange block on top of the red block",
                    true
                ],
                "4": [
                    "pick up the blue block",
                    true
                ],
                "5": [
                    "stack the blue block on top of the orange block",
                    true
                ]
            }
        },
        "chat": {
            "goal_achieved": true,
            "content": "human: I am playing with a set of blocks where I need to arrange the blocks into stacks. Here are the actions I can do\n\nPick up a block\nUnstack a block from on top of another block\nPut down a block\nStack a block on top of another block\n\nI have the following restrictions on my actions:\nI can only pick up or unstack one block at a time.\nI can only pick up or unstack a block if my hand is empty.\nI can only pick up a block if the block is on the table and the block is clear. A block is clear if the block has no other blocks on top of it and if the block is not picked up.\nI can only unstack a block from on top of another block if the block I am unstacking was really on top of the other block.\nI can only unstack a block from on top of another block if the block I am unstacking is clear.\nOnce I pick up or unstack a block, I am holding the block.\nI can only put down a block that I am holding.\nI can only stack a block on top of another block if I am holding the block being stacked.\nI can only stack a block on top of another block if the block onto which I am stacking the block is clear.\nOnce I put down or stack a block, my hand becomes empty.\nOnce you stack a block on top of a second block, the second block is no longer clear.\n[STATEMENT]\nAs initial conditions I have that, the blue block is clear, the orange block is clear, the hand is empty, the blue block is on top of the red block, the red block is on the table and the orange block is on the table.\nMy goal is to have that the red block is on top of the blue block and the orange block is on top of the red block.\n\nReturn the first action I need to take to achieve my goal. Return one, and only one, action, without nothing more.\npick up the orange block\nhuman: Good action! Return the next action to achieve my goal. Return one, and only one, action, without nothing more.\nput down the orange block\nhuman: Good action! Return the next action to achieve my goal. Return one, and only one, action, without nothing more.\npick up the blue block\nhuman: This action is not possible due to the set of restrictions. Return one action that is allowed by the set of restrictions. Return one, and only one, action, without nothing more.\nunstack the blue block from on top of the red block\nhuman: Good action! Return the next action to achieve my goal. Return one, and only one, action, without nothing more.\nput down the blue block\nhuman: Good action! Return the next action to achieve my goal. Return one, and only one, action, without nothing more.\npick up the red block\nhuman: Good action! Return the next action to achieve my goal. Return one, and only one, action, without nothing more.\npick up the blue block\nhuman: This action is not possible due to the set of restrictions. Return one action that is allowed by the set of restrictions. Return one, and only one, action, without nothing more.\nunstack the orange block from on top of the red block\nhuman: This action is not possible due to the set of restrictions. Return one action that is allowed by the set of restrictions. Return one, and only one, action, without nothing more.\nstack the red block on top of the blue block\nhuman: Good action! Return the next action to achieve my goal. Return one, and only one, action, without nothing more.\npick up the orange block\nhuman: Good action! Return the next action to achieve my goal. Return one, and only one, action, without nothing more.\nstack the orange block on top of the red block\n\n[STATEMENT]\nAs initial conditions I have that, the blue block is clear, the orange block is clear, the hand is empty, the blue block is on top of the red block, the red block is on the table and the orange block is on the table.\nMy goal is to have that the blue block is on top of the orange block and the orange block is on top of the red block.\n\nReturn the first action I need to take to achieve my goal. Return one, and only one, action, without nothing more.\n\nai: unstack the blue block from on top of the red block\nhuman: Good action! Return the next action to achieve my goal. Return one, and only one, action, without nothing more.\n\nai: put down the blue block\nhuman: Good action! Return the next action to achieve my goal. Return one, and only one, action, without nothing more.\n\nai: pick up the orange block\nhuman: Good action! Return the next action to achieve my goal. Return one, and only one, action, without nothing more.\n\nai: stack the orange block on top of the red block\nhuman: Good action! Return the next action to achieve my goal. Return one, and only one, action, without nothing more.\n\nai: pick up the blue block\nhuman: Good action! Return the next action to achieve my goal. Return one, and only one, action, without nothing more.\n\nai: stack the blue block on top of the orange block",
            "actions": {
                "0": [
                    "unstack the blue block from on top of the red block",
                    true
                ],
                "1": [
                    "put down the blue block",
                    true
                ],
                "2": [
                    "pick up the orange block",
                    true
                ],
                "3": [
                    "stack the orange block on top of the red block",
                    true
                ],
                "4": [
                    "pick up the blue block",
                    true
                ],
                "5": [
                    "stack the blue block on top of the orange block",
                    true
                ]
            }
        }
    },
    "2": {
        "only_prompt": {
            "goal_achieved": false,
            "content": "I am playing with a set of blocks where I need to arrange the blocks into stacks. Here are the actions I can do\n\nPick up a block\nUnstack a block from on top of another block\nPut down a block\nStack a block on top of another block\n\nI have the following restrictions on my actions:\nI can only pick up or unstack one block at a time.\nI can only pick up or unstack a block if my hand is empty.\nI can only pick up a block if the block is on the table and the block is clear. A block is clear if the block has no other blocks on top of it and if the block is not picked up.\nI can only unstack a block from on top of another block if the block I am unstacking was really on top of the other block.\nI can only unstack a block from on top of another block if the block I am unstacking is clear.\nOnce I pick up or unstack a block, I am holding the block.\nI can only put down a block that I am holding.\nI can only stack a block on top of another block if I am holding the block being stacked.\nI can only stack a block on top of another block if the block onto which I am stacking the block is clear.\nOnce I put down or stack a block, my hand becomes empty.\nOnce you stack a block on top of a second block, the second block is no longer clear.\n\n[STATEMENT]\nAs initial conditions I have that, the blue block is clear, the orange block is clear, the hand is empty, the blue block is on top of the red block, the red block is on the table and the orange block is on the table.\nMy goal is to have that the blue block is on top of the orange block and the orange block is on top of the red block.\n\nMy plan is as follows:\n\n[PLAN]\nunstack the blue block from on top of the red block\nput down the blue block\npick up the orange block\nstack the orange block on top of the red block\npick up the blue block\nstack the blue block on top of the orange block\n[PLAN END]\n\n[STATEMENT]\nAs initial conditions I have that, the red block is clear, the blue block is clear, the hand is empty, the red block is on top of the orange block, the blue block is on the table and the orange block is on the table.\nMy goal is to have that the red block is on top of the orange block and the orange block is on top of the blue block.\n\nMy plan is as follows:\n\n[PLAN]pick up the red block\nput down the red block\npick up the blue block\nstack the blue block on top of the orange block\npick up the red block\nstack the red block on top of the orange block",
            "actions": {
                "0": [
                    "pick up the red block",
                    false
                ],
                "1": [
                    "put down the red block",
                    false
                ],
                "2": [
                    "pick up the blue block",
                    true
                ],
                "3": [
                    "stack the blue block on top of the orange block",
                    false
                ],
                "4": [
                    "pick up the red block",
                    false
                ],
                "5": [
                    "stack the red block on top of the orange block",
                    false
                ]
            }
        },
        "chat": {
            "goal_achieved": true,
            "content": "human: I am playing with a set of blocks where I need to arrange the blocks into stacks. Here are the actions I can do\n\nPick up a block\nUnstack a block from on top of another block\nPut down a block\nStack a block on top of another block\n\nI have the following restrictions on my actions:\nI can only pick up or unstack one block at a time.\nI can only pick up or unstack a block if my hand is empty.\nI can only pick up a block if the block is on the table and the block is clear. A block is clear if the block has no other blocks on top of it and if the block is not picked up.\nI can only unstack a block from on top of another block if the block I am unstacking was really on top of the other block.\nI can only unstack a block from on top of another block if the block I am unstacking is clear.\nOnce I pick up or unstack a block, I am holding the block.\nI can only put down a block that I am holding.\nI can only stack a block on top of another block if I am holding the block being stacked.\nI can only stack a block on top of another block if the block onto which I am stacking the block is clear.\nOnce I put down or stack a block, my hand becomes empty.\nOnce you stack a block on top of a second block, the second block is no longer clear.\n[STATEMENT]\nAs initial conditions I have that, the blue block is clear, the orange block is clear, the hand is empty, the blue block is on top of the red block, the red block is on the table and the orange block is on the table.\nMy goal is to have that the red block is on top of the blue block and the orange block is on top of the red block.\n\nReturn the first action I need to take to achieve my goal. Return one, and only one, action, without nothing more.\npick up the orange block\nhuman: Good action! Return the next action to achieve my goal. Return one, and only one, action, without nothing more.\nput down the orange block\nhuman: Good action! Return the next action to achieve my goal. Return one, and only one, action, without nothing more.\npick up the blue block\nhuman: This action is not possible due to the set of restrictions. Return one action that is allowed by the set of restrictions. Return one, and only one, action, without nothing more.\nunstack the blue block from on top of the red block\nhuman: Good action! Return the next action to achieve my goal. Return one, and only one, action, without nothing more.\nput down the blue block\nhuman: Good action! Return the next action to achieve my goal. Return one, and only one, action, without nothing more.\npick up the red block\nhuman: Good action! Return the next action to achieve my goal. Return one, and only one, action, without nothing more.\npick up the blue block\nhuman: This action is not possible due to the set of restrictions. Return one action that is allowed by the set of restrictions. Return one, and only one, action, without nothing more.\nunstack the orange block from on top of the red block\nhuman: This action is not possible due to the set of restrictions. Return one action that is allowed by the set of restrictions. Return one, and only one, action, without nothing more.\nstack the red block on top of the blue block\nhuman: Good action! Return the next action to achieve my goal. Return one, and only one, action, without nothing more.\npick up the orange block\nhuman: Good action! Return the next action to achieve my goal. Return one, and only one, action, without nothing more.\nstack the orange block on top of the red block\n\n[STATEMENT]\nAs initial conditions I have that, the red block is clear, the blue block is clear, the hand is empty, the red block is on top of the orange block, the blue block is on the table and the orange block is on the table.\nMy goal is to have that the red block is on top of the orange block and the orange block is on top of the blue block.\n\nReturn the first action I need to take to achieve my goal. Return one, and only one, action, without nothing more.\n\nai: pick up the red block\nhuman: This action is not possible due to the set of restrictions. Return one action that is allowed by the set of restrictions. Return one, and only one, action, without nothing more.\n\nai: pick up the blue block\nhuman: Good action! Return the next action to achieve my goal. Return one, and only one, action, without nothing more.\n\nai: put down the blue block\nhuman: Good action! Return the next action to achieve my goal. Return one, and only one, action, without nothing more.\n\nai: pick up the red block\nhuman: This action is not possible due to the set of restrictions. Return one action that is allowed by the set of restrictions. Return one, and only one, action, without nothing more.\n\nai: unstack the red block from on top of the orange block\nhuman: Good action! Return the next action to achieve my goal. Return one, and only one, action, without nothing more.\n\nai: put down the red block\nhuman: Good action! Return the next action to achieve my goal. Return one, and only one, action, without nothing more.\n\nai: pick up the orange block\nhuman: Good action! Return the next action to achieve my goal. Return one, and only one, action, without nothing more.\n\nai: stack the orange block on top of the blue block\nhuman: Good action! Return the next action to achieve my goal. Return one, and only one, action, without nothing more.\n\nai: pick up the red block\nhuman: Good action! Return the next action to achieve my goal. Return one, and only one, action, without nothing more.\n\nai: stack the red block on top of the orange block",
            "actions": {
                "0": [
                    "pick up the red block",
                    false
                ],
                "1": [
                    "pick up the blue block",
                    true
                ],
                "2": [
                    "put down the blue block",
                    true
                ],
                "3": [
                    "pick up the red block",
                    false
                ],
                "4": [
                    "unstack the red block from on top of the orange block",
                    true
                ],
                "5": [
                    "put down the red block",
                    true
                ],
                "6": [
                    "pick up the orange block",
                    true
                ],
                "7": [
                    "stack the orange block on top of the blue block",
                    true
                ],
                "8": [
                    "pick up the red block",
                    true
                ],
                "9": [
                    "stack the red block on top of the orange block",
                    true
                ]
            }
        }
    },
    "3": {
        "only_prompt": {
            "goal_achieved": false,
            "content": "I am playing with a set of blocks where I need to arrange the blocks into stacks. Here are the actions I can do\n\nPick up a block\nUnstack a block from on top of another block\nPut down a block\nStack a block on top of another block\n\nI have the following restrictions on my actions:\nI can only pick up or unstack one block at a time.\nI can only pick up or unstack a block if my hand is empty.\nI can only pick up a block if the block is on the table and the block is clear. A block is clear if the block has no other blocks on top of it and if the block is not picked up.\nI can only unstack a block from on top of another block if the block I am unstacking was really on top of the other block.\nI can only unstack a block from on top of another block if the block I am unstacking is clear.\nOnce I pick up or unstack a block, I am holding the block.\nI can only put down a block that I am holding.\nI can only stack a block on top of another block if I am holding the block being stacked.\nI can only stack a block on top of another block if the block onto which I am stacking the block is clear.\nOnce I put down or stack a block, my hand becomes empty.\nOnce you stack a block on top of a second block, the second block is no longer clear.\n\n[STATEMENT]\nAs initial conditions I have that, the red block is clear, the blue block is clear, the hand is empty, the red block is on top of the orange block, the blue block is on the table and the orange block is on the table.\nMy goal is to have that the red block is on top of the orange block and the orange block is on top of the blue block.\n\nMy plan is as follows:\n\n[PLAN]\nunstack the red block from on top of the orange block\nput down the red block\npick up the orange block\nstack the orange block on top of the blue block\npick up the red block\nstack the red block on top of the orange block\n[PLAN END]\n\n[STATEMENT]\nAs initial conditions I have that, the red block is clear, the orange block is clear, the hand is empty, the orange block is on top of the blue block, the red block is on the table and the blue block is on the table.\nMy goal is to have that the red block is on top of the blue block.\n\nMy plan is as follows:\n\n[PLAN]pick up the red block\nstack the red block on top of the blue block",
            "actions": {
                "0": [
                    "pick up the red block",
                    true
                ],
                "1": [
                    "stack the red block on top of the blue block",
                    false
                ]
            }
        },
        "chat": {
            "goal_achieved": true,
            "content": "human: I am playing with a set of blocks where I need to arrange the blocks into stacks. Here are the actions I can do\n\nPick up a block\nUnstack a block from on top of another block\nPut down a block\nStack a block on top of another block\n\nI have the following restrictions on my actions:\nI can only pick up or unstack one block at a time.\nI can only pick up or unstack a block if my hand is empty.\nI can only pick up a block if the block is on the table and the block is clear. A block is clear if the block has no other blocks on top of it and if the block is not picked up.\nI can only unstack a block from on top of another block if the block I am unstacking was really on top of the other block.\nI can only unstack a block from on top of another block if the block I am unstacking is clear.\nOnce I pick up or unstack a block, I am holding the block.\nI can only put down a block that I am holding.\nI can only stack a block on top of another block if I am holding the block being stacked.\nI can only stack a block on top of another block if the block onto which I am stacking the block is clear.\nOnce I put down or stack a block, my hand becomes empty.\nOnce you stack a block on top of a second block, the second block is no longer clear.\n[STATEMENT]\nAs initial conditions I have that, the blue block is clear, the orange block is clear, the hand is empty, the blue block is on top of the red block, the red block is on the table and the orange block is on the table.\nMy goal is to have that the red block is on top of the blue block and the orange block is on top of the red block.\n\nReturn the first action I need to take to achieve my goal. Return one, and only one, action, without nothing more.\npick up the orange block\nhuman: Good action! Return the next action to achieve my goal. Return one, and only one, action, without nothing more.\nput down the orange block\nhuman: Good action! Return the next action to achieve my goal. Return one, and only one, action, without nothing more.\npick up the blue block\nhuman: This action is not possible due to the set of restrictions. Return one action that is allowed by the set of restrictions. Return one, and only one, action, without nothing more.\nunstack the blue block from on top of the red block\nhuman: Good action! Return the next action to achieve my goal. Return one, and only one, action, without nothing more.\nput down the blue block\nhuman: Good action! Return the next action to achieve my goal. Return one, and only one, action, without nothing more.\npick up the red block\nhuman: Good action! Return the next action to achieve my goal. Return one, and only one, action, without nothing more.\npick up the blue block\nhuman: This action is not possible due to the set of restrictions. Return one action that is allowed by the set of restrictions. Return one, and only one, action, without nothing more.\nunstack the orange block from on top of the red block\nhuman: This action is not possible due to the set of restrictions. Return one action that is allowed by the set of restrictions. Return one, and only one, action, without nothing more.\nstack the red block on top of the blue block\nhuman: Good action! Return the next action to achieve my goal. Return one, and only one, action, without nothing more.\npick up the orange block\nhuman: Good action! Return the next action to achieve my goal. Return one, and only one, action, without nothing more.\nstack the orange block on top of the red block\n\n[STATEMENT]\nAs initial conditions I have that, the red block is clear, the orange block is clear, the hand is empty, the orange block is on top of the blue block, the red block is on the table and the blue block is on the table.\nMy goal is to have that the red block is on top of the blue block.\n\nReturn the first action I need to take to achieve my goal. Return one, and only one, action, without nothing more.\n\nai: unstack the orange block from on top of the blue block\nhuman: Good action! Return the next action to achieve my goal. Return one, and only one, action, without nothing more.\n\nai: put down the orange block\nhuman: Good action! Return the next action to achieve my goal. Return one, and only one, action, without nothing more.\n\nai: pick up the red block\nhuman: Good action! Return the next action to achieve my goal. Return one, and only one, action, without nothing more.\n\nai: stack the red block on top of the blue block",
            "actions": {
                "0": [
                    "unstack the orange block from on top of the blue block",
                    true
                ],
                "1": [
                    "put down the orange block",
                    true
                ],
                "2": [
                    "pick up the red block",
                    true
                ],
                "3": [
                    "stack the red block on top of the blue block",
                    true
                ]
            }
        }
    },
    "4": {
        "only_prompt": {
            "goal_achieved": true,
            "content": "I am playing with a set of blocks where I need to arrange the blocks into stacks. Here are the actions I can do\n\nPick up a block\nUnstack a block from on top of another block\nPut down a block\nStack a block on top of another block\n\nI have the following restrictions on my actions:\nI can only pick up or unstack one block at a time.\nI can only pick up or unstack a block if my hand is empty.\nI can only pick up a block if the block is on the table and the block is clear. A block is clear if the block has no other blocks on top of it and if the block is not picked up.\nI can only unstack a block from on top of another block if the block I am unstacking was really on top of the other block.\nI can only unstack a block from on top of another block if the block I am unstacking is clear.\nOnce I pick up or unstack a block, I am holding the block.\nI can only put down a block that I am holding.\nI can only stack a block on top of another block if I am holding the block being stacked.\nI can only stack a block on top of another block if the block onto which I am stacking the block is clear.\nOnce I put down or stack a block, my hand becomes empty.\nOnce you stack a block on top of a second block, the second block is no longer clear.\n\n[STATEMENT]\nAs initial conditions I have that, the red block is clear, the orange block is clear, the hand is empty, the orange block is on top of the blue block, the red block is on the table and the blue block is on the table.\nMy goal is to have that the red block is on top of the blue block.\n\nMy plan is as follows:\n\n[PLAN]\nunstack the orange block from on top of the blue block\nput down the orange block\npick up the red block\nstack the red block on top of the blue block\n[PLAN END]\n\n[STATEMENT]\nAs initial conditions I have that, the blue block is clear, the hand is empty, the blue block is on top of the orange block, the orange block is on top of the red block and the red block is on the table.\nMy goal is to have that the red block is on top of the orange block and the blue block is on top of the red block.\n\nMy plan is as follows:\n\n[PLAN]unstack the blue block from on top of the orange block\nput down the blue block\nunstack the orange block from on top of the red block\nput down the orange block\npick up the red block\nstack the red block on top of the orange block\npick up the blue block\nstack the blue block on top of the red block",
            "actions": {
                "0": [
                    "unstack the blue block from on top of the orange block",
                    true
                ],
                "1": [
                    "put down the blue block",
                    true
                ],
                "2": [
                    "unstack the orange block from on top of the red block",
                    true
                ],
                "3": [
                    "put down the orange block",
                    true
                ],
                "4": [
                    "pick up the red block",
                    true
                ],
                "5": [
                    "stack the red block on top of the orange block",
                    true
                ],
                "6": [
                    "pick up the blue block",
                    true
                ],
                "7": [
                    "stack the blue block on top of the red block",
                    true
                ]
            }
        },
        "chat": {
            "goal_achieved": false,
            "content": "human: I am playing with a set of blocks where I need to arrange the blocks into stacks. Here are the actions I can do\n\nPick up a block\nUnstack a block from on top of another block\nPut down a block\nStack a block on top of another block\n\nI have the following restrictions on my actions:\nI can only pick up or unstack one block at a time.\nI can only pick up or unstack a block if my hand is empty.\nI can only pick up a block if the block is on the table and the block is clear. A block is clear if the block has no other blocks on top of it and if the block is not picked up.\nI can only unstack a block from on top of another block if the block I am unstacking was really on top of the other block.\nI can only unstack a block from on top of another block if the block I am unstacking is clear.\nOnce I pick up or unstack a block, I am holding the block.\nI can only put down a block that I am holding.\nI can only stack a block on top of another block if I am holding the block being stacked.\nI can only stack a block on top of another block if the block onto which I am stacking the block is clear.\nOnce I put down or stack a block, my hand becomes empty.\nOnce you stack a block on top of a second block, the second block is no longer clear.\n[STATEMENT]\nAs initial conditions I have that, the blue block is clear, the orange block is clear, the hand is empty, the blue block is on top of the red block, the red block is on the table and the orange block is on the table.\nMy goal is to have that the red block is on top of the blue block and the orange block is on top of the red block.\n\nReturn the first action I need to take to achieve my goal. Return one, and only one, action, without nothing more.\npick up the orange block\nhuman: Good action! Return the next action to achieve my goal. Return one, and only one, action, without nothing more.\nput down the orange block\nhuman: Good action! Return the next action to achieve my goal. Return one, and only one, action, without nothing more.\npick up the blue block\nhuman: This action is not possible due to the set of restrictions. Return one action that is allowed by the set of restrictions. Return one, and only one, action, without nothing more.\nunstack the blue block from on top of the red block\nhuman: Good action! Return the next action to achieve my goal. Return one, and only one, action, without nothing more.\nput down the blue block\nhuman: Good action! Return the next action to achieve my goal. Return one, and only one, action, without nothing more.\npick up the red block\nhuman: Good action! Return the next action to achieve my goal. Return one, and only one, action, without nothing more.\npick up the blue block\nhuman: This action is not possible due to the set of restrictions. Return one action that is allowed by the set of restrictions. Return one, and only one, action, without nothing more.\nunstack the orange block from on top of the red block\nhuman: This action is not possible due to the set of restrictions. Return one action that is allowed by the set of restrictions. Return one, and only one, action, without nothing more.\nstack the red block on top of the blue block\nhuman: Good action! Return the next action to achieve my goal. Return one, and only one, action, without nothing more.\npick up the orange block\nhuman: Good action! Return the next action to achieve my goal. Return one, and only one, action, without nothing more.\nstack the orange block on top of the red block\n\n[STATEMENT]\nAs initial conditions I have that, the blue block is clear, the hand is empty, the blue block is on top of the orange block, the orange block is on top of the red block and the red block is on the table.\nMy goal is to have that the red block is on top of the orange block and the blue block is on top of the red block.\n\nReturn the first action I need to take to achieve my goal. Return one, and only one, action, without nothing more.\n\nai: unstack the blue block from on top of the orange block\nhuman: Good action! Return the next action to achieve my goal. Return one, and only one, action, without nothing more.\n\nai: put down the blue block\nhuman: Good action! Return the next action to achieve my goal. Return one, and only one, action, without nothing more.\n\nai: unstack the orange block from on top of the red block\nhuman: Good action! Return the next action to achieve my goal. Return one, and only one, action, without nothing more.\n\nai: put down the orange block\nhuman: Good action! Return the next action to achieve my goal. Return one, and only one, action, without nothing more.\n\nai: pick up the blue block\nhuman: Good action! Return the next action to achieve my goal. Return one, and only one, action, without nothing more.\n\nai: stack the blue block on top of the red block\nhuman: Good action! Return the next action to achieve my goal. Return one, and only one, action, without nothing more.\n\nai: pick up the orange block\nhuman: Good action! Return the next action to achieve my goal. Return one, and only one, action, without nothing more.\n\nai: stack the orange block on top of the red block\nhuman: This action is not possible due to the set of restrictions. Return one action that is allowed by the set of restrictions. Return one, and only one, action, without nothing more.\n\nai: stack the orange block on top of the blue block\nhuman: Good action! Return the next action to achieve my goal. Return one, and only one, action, without nothing more.\n\nai: pick up the red block\nhuman: This action is not possible due to the set of restrictions. Return one action that is allowed by the set of restrictions. Return one, and only one, action, without nothing more.\n\nai: pick up the blue block\nhuman: This action is not possible due to the set of restrictions. Return one action that is allowed by the set of restrictions. Return one, and only one, action, without nothing more.\n\nai: There seems to have been a mistake in my previous responses. Given the current state and the goal, the correct next action should be:\n\npick up the orange block",
            "actions": {
                "0": [
                    "unstack the blue block from on top of the orange block",
                    true
                ],
                "1": [
                    "put down the blue block",
                    true
                ],
                "2": [
                    "unstack the orange block from on top of the red block",
                    true
                ],
                "3": [
                    "put down the orange block",
                    true
                ],
                "4": [
                    "pick up the blue block",
                    true
                ],
                "5": [
                    "stack the blue block on top of the red block",
                    true
                ],
                "6": [
                    "pick up the orange block",
                    true
                ],
                "7": [
                    "stack the orange block on top of the red block",
                    false
                ],
                "8": [
                    "stack the orange block on top of the blue block",
                    true
                ],
                "9": [
                    "pick up the red block",
                    false
                ],
                "10": [
                    "pick up the blue block",
                    false
                ]
            }
        }
    },
    "5": {
        "only_prompt": {
            "goal_achieved": false,
            "content": "I am playing with a set of blocks where I need to arrange the blocks into stacks. Here are the actions I can do\n\nPick up a block\nUnstack a block from on top of another block\nPut down a block\nStack a block on top of another block\n\nI have the following restrictions on my actions:\nI can only pick up or unstack one block at a time.\nI can only pick up or unstack a block if my hand is empty.\nI can only pick up a block if the block is on the table and the block is clear. A block is clear if the block has no other blocks on top of it and if the block is not picked up.\nI can only unstack a block from on top of another block if the block I am unstacking was really on top of the other block.\nI can only unstack a block from on top of another block if the block I am unstacking is clear.\nOnce I pick up or unstack a block, I am holding the block.\nI can only put down a block that I am holding.\nI can only stack a block on top of another block if I am holding the block being stacked.\nI can only stack a block on top of another block if the block onto which I am stacking the block is clear.\nOnce I put down or stack a block, my hand becomes empty.\nOnce you stack a block on top of a second block, the second block is no longer clear.\n\n[STATEMENT]\nAs initial conditions I have that, the blue block is clear, the hand is empty, the blue block is on top of the orange block, the orange block is on top of the red block and the red block is on the table.\nMy goal is to have that the red block is on top of the orange block and the blue block is on top of the red block.\n\nMy plan is as follows:\n\n[PLAN]\nunstack the blue block from on top of the orange block\nput down the blue block\nunstack the orange block from on top of the red block\nput down the orange block\npick up the red block\nstack the red block on top of the orange block\npick up the blue block\nstack the blue block on top of the red block\n[PLAN END]\n\n[STATEMENT]\nAs initial conditions I have that, the red block is clear, the blue block is clear, the orange block is clear, the hand is empty, the red block is on the table, the blue block is on the table and the orange block is on the table.\nMy goal is to have that the red block is on top of the blue block and the orange block is on top of the red block.\n\nMy plan is as follows:\n\n[PLAN]pick up the orange block\nstack the orange block on top of the red block\npick up the blue block\nstack the blue block on top of the orange block",
            "actions": {
                "0": [
                    "pick up the orange block",
                    true
                ],
                "1": [
                    "stack the orange block on top of the red block",
                    true
                ],
                "2": [
                    "pick up the blue block",
                    true
                ],
                "3": [
                    "stack the blue block on top of the orange block",
                    true
                ]
            }
        },
        "chat": {
            "goal_achieved": true,
            "content": "human: I am playing with a set of blocks where I need to arrange the blocks into stacks. Here are the actions I can do\n\nPick up a block\nUnstack a block from on top of another block\nPut down a block\nStack a block on top of another block\n\nI have the following restrictions on my actions:\nI can only pick up or unstack one block at a time.\nI can only pick up or unstack a block if my hand is empty.\nI can only pick up a block if the block is on the table and the block is clear. A block is clear if the block has no other blocks on top of it and if the block is not picked up.\nI can only unstack a block from on top of another block if the block I am unstacking was really on top of the other block.\nI can only unstack a block from on top of another block if the block I am unstacking is clear.\nOnce I pick up or unstack a block, I am holding the block.\nI can only put down a block that I am holding.\nI can only stack a block on top of another block if I am holding the block being stacked.\nI can only stack a block on top of another block if the block onto which I am stacking the block is clear.\nOnce I put down or stack a block, my hand becomes empty.\nOnce you stack a block on top of a second block, the second block is no longer clear.\n[STATEMENT]\nAs initial conditions I have that, the blue block is clear, the orange block is clear, the hand is empty, the blue block is on top of the red block, the red block is on the table and the orange block is on the table.\nMy goal is to have that the red block is on top of the blue block and the orange block is on top of the red block.\n\nReturn the first action I need to take to achieve my goal. Return one, and only one, action, without nothing more.\npick up the orange block\nhuman: Good action! Return the next action to achieve my goal. Return one, and only one, action, without nothing more.\nput down the orange block\nhuman: Good action! Return the next action to achieve my goal. Return one, and only one, action, without nothing more.\npick up the blue block\nhuman: This action is not possible due to the set of restrictions. Return one action that is allowed by the set of restrictions. Return one, and only one, action, without nothing more.\nunstack the blue block from on top of the red block\nhuman: Good action! Return the next action to achieve my goal. Return one, and only one, action, without nothing more.\nput down the blue block\nhuman: Good action! Return the next action to achieve my goal. Return one, and only one, action, without nothing more.\npick up the red block\nhuman: Good action! Return the next action to achieve my goal. Return one, and only one, action, without nothing more.\npick up the blue block\nhuman: This action is not possible due to the set of restrictions. Return one action that is allowed by the set of restrictions. Return one, and only one, action, without nothing more.\nunstack the orange block from on top of the red block\nhuman: This action is not possible due to the set of restrictions. Return one action that is allowed by the set of restrictions. Return one, and only one, action, without nothing more.\nstack the red block on top of the blue block\nhuman: Good action! Return the next action to achieve my goal. Return one, and only one, action, without nothing more.\npick up the orange block\nhuman: Good action! Return the next action to achieve my goal. Return one, and only one, action, without nothing more.\nstack the orange block on top of the red block\n\n[STATEMENT]\nAs initial conditions I have that, the red block is clear, the blue block is clear, the orange block is clear, the hand is empty, the red block is on the table, the blue block is on the table and the orange block is on the table.\nMy goal is to have that the red block is on top of the blue block and the orange block is on top of the red block.\n\nReturn the first action I need to take to achieve my goal. Return one, and only one, action, without nothing more.\n\nai: pick up the orange block\nhuman: Good action! Return the next action to achieve my goal. Return one, and only one, action, without nothing more.\n\nai: put down the orange block\nhuman: Good action! Return the next action to achieve my goal. Return one, and only one, action, without nothing more.\n\nai: pick up the red block\nhuman: Good action! Return the next action to achieve my goal. Return one, and only one, action, without nothing more.\n\nai: stack the red block on top of the blue block\nhuman: Good action! Return the next action to achieve my goal. Return one, and only one, action, without nothing more.\n\nai: pick up the orange block\nhuman: Good action! Return the next action to achieve my goal. Return one, and only one, action, without nothing more.\n\nai: stack the orange block on top of the red block",
            "actions": {
                "0": [
                    "pick up the orange block",
                    true
                ],
                "1": [
                    "put down the orange block",
                    true
                ],
                "2": [
                    "pick up the red block",
                    true
                ],
                "3": [
                    "stack the red block on top of the blue block",
                    true
                ],
                "4": [
                    "pick up the orange block",
                    true
                ],
                "5": [
                    "stack the orange block on top of the red block",
                    true
                ]
            }
        }
    },
    "6": {
        "only_prompt": {
            "goal_achieved": false,
            "content": "I am playing with a set of blocks where I need to arrange the blocks into stacks. Here are the actions I can do\n\nPick up a block\nUnstack a block from on top of another block\nPut down a block\nStack a block on top of another block\n\nI have the following restrictions on my actions:\nI can only pick up or unstack one block at a time.\nI can only pick up or unstack a block if my hand is empty.\nI can only pick up a block if the block is on the table and the block is clear. A block is clear if the block has no other blocks on top of it and if the block is not picked up.\nI can only unstack a block from on top of another block if the block I am unstacking was really on top of the other block.\nI can only unstack a block from on top of another block if the block I am unstacking is clear.\nOnce I pick up or unstack a block, I am holding the block.\nI can only put down a block that I am holding.\nI can only stack a block on top of another block if I am holding the block being stacked.\nI can only stack a block on top of another block if the block onto which I am stacking the block is clear.\nOnce I put down or stack a block, my hand becomes empty.\nOnce you stack a block on top of a second block, the second block is no longer clear.\n\n[STATEMENT]\nAs initial conditions I have that, the red block is clear, the blue block is clear, the orange block is clear, the hand is empty, the red block is on the table, the blue block is on the table and the orange block is on the table.\nMy goal is to have that the red block is on top of the blue block and the orange block is on top of the red block.\n\nMy plan is as follows:\n\n[PLAN]\npick up the red block\nstack the red block on top of the blue block\npick up the orange block\nstack the orange block on top of the red block\n[PLAN END]\n\n[STATEMENT]\nAs initial conditions I have that, the orange block is clear, the hand is empty, the blue block is on top of the red block, the orange block is on top of the blue block and the red block is on the table.\nMy goal is to have that the red block is on top of the orange block and the orange block is on top of the blue block.\n\nMy plan is as follows:\n\n[PLAN]pick up the red block\nunstack the orange block from on top of the blue block\nstack the red block on top of the orange block",
            "actions": {
                "0": [
                    "pick up the red block",
                    false
                ],
                "1": [
                    "unstack the orange block from on top of the blue block",
                    true
                ],
                "2": [
                    "stack the red block on top of the orange block",
                    false
                ]
            }
        },
        "chat": {
            "goal_achieved": false,
            "content": "human: I am playing with a set of blocks where I need to arrange the blocks into stacks. Here are the actions I can do\n\nPick up a block\nUnstack a block from on top of another block\nPut down a block\nStack a block on top of another block\n\nI have the following restrictions on my actions:\nI can only pick up or unstack one block at a time.\nI can only pick up or unstack a block if my hand is empty.\nI can only pick up a block if the block is on the table and the block is clear. A block is clear if the block has no other blocks on top of it and if the block is not picked up.\nI can only unstack a block from on top of another block if the block I am unstacking was really on top of the other block.\nI can only unstack a block from on top of another block if the block I am unstacking is clear.\nOnce I pick up or unstack a block, I am holding the block.\nI can only put down a block that I am holding.\nI can only stack a block on top of another block if I am holding the block being stacked.\nI can only stack a block on top of another block if the block onto which I am stacking the block is clear.\nOnce I put down or stack a block, my hand becomes empty.\nOnce you stack a block on top of a second block, the second block is no longer clear.\n[STATEMENT]\nAs initial conditions I have that, the blue block is clear, the orange block is clear, the hand is empty, the blue block is on top of the red block, the red block is on the table and the orange block is on the table.\nMy goal is to have that the red block is on top of the blue block and the orange block is on top of the red block.\n\nReturn the first action I need to take to achieve my goal. Return one, and only one, action, without nothing more.\npick up the orange block\nhuman: Good action! Return the next action to achieve my goal. Return one, and only one, action, without nothing more.\nput down the orange block\nhuman: Good action! Return the next action to achieve my goal. Return one, and only one, action, without nothing more.\npick up the blue block\nhuman: This action is not possible due to the set of restrictions. Return one action that is allowed by the set of restrictions. Return one, and only one, action, without nothing more.\nunstack the blue block from on top of the red block\nhuman: Good action! Return the next action to achieve my goal. Return one, and only one, action, without nothing more.\nput down the blue block\nhuman: Good action! Return the next action to achieve my goal. Return one, and only one, action, without nothing more.\npick up the red block\nhuman: Good action! Return the next action to achieve my goal. Return one, and only one, action, without nothing more.\npick up the blue block\nhuman: This action is not possible due to the set of restrictions. Return one action that is allowed by the set of restrictions. Return one, and only one, action, without nothing more.\nunstack the orange block from on top of the red block\nhuman: This action is not possible due to the set of restrictions. Return one action that is allowed by the set of restrictions. Return one, and only one, action, without nothing more.\nstack the red block on top of the blue block\nhuman: Good action! Return the next action to achieve my goal. Return one, and only one, action, without nothing more.\npick up the orange block\nhuman: Good action! Return the next action to achieve my goal. Return one, and only one, action, without nothing more.\nstack the orange block on top of the red block\n\n[STATEMENT]\nAs initial conditions I have that, the orange block is clear, the hand is empty, the blue block is on top of the red block, the orange block is on top of the blue block and the red block is on the table.\nMy goal is to have that the red block is on top of the orange block and the orange block is on top of the blue block.\n\nReturn the first action I need to take to achieve my goal. Return one, and only one, action, without nothing more.\n\nai: unstack the orange block from on top of the blue block\nhuman: Good action! Return the next action to achieve my goal. Return one, and only one, action, without nothing more.\n\nai: put down the orange block\nhuman: Good action! Return the next action to achieve my goal. Return one, and only one, action, without nothing more.\n\nai: pick up the blue block\nhuman: This action is not possible due to the set of restrictions. Return one action that is allowed by the set of restrictions. Return one, and only one, action, without nothing more.\n\nai: unstack the blue block from on top of the red block\nhuman: Good action! Return the next action to achieve my goal. Return one, and only one, action, without nothing more.\n\nai: put down the blue block\nhuman: Good action! Return the next action to achieve my goal. Return one, and only one, action, without nothing more.\n\nai: pick up the red block\nhuman: Good action! Return the next action to achieve my goal. Return one, and only one, action, without nothing more.\n\nai: stack the red block on top of the orange block\nhuman: Good action! Return the next action to achieve my goal. Return one, and only one, action, without nothing more.\n\nai: pick up the blue block\nhuman: Good action! Return the next action to achieve my goal. Return one, and only one, action, without nothing more.\n\nai: stack the blue block on top of the red block\nhuman: Good action! Return the next action to achieve my goal. Return one, and only one, action, without nothing more.\n\nai: pick up the orange block\nhuman: This action is not possible due to the set of restrictions. Return one action that is allowed by the set of restrictions. Return one, and only one, action, without nothing more.\n\nai: stack the orange block on top of the blue block\nhuman: This action is not possible due to the set of restrictions. Return one action that is allowed by the set of restrictions. Return one, and only one, action, without nothing more.\n\nai: pick up the blue block\nhuman: This action is not possible due to the set of restrictions. Return one action that is allowed by the set of restrictions. Return one, and only one, action, without nothing more.\n\nai: stack the orange block on top of the red block\nhuman: This action is not possible due to the set of restrictions. Return one action that is allowed by the set of restrictions. Return one, and only one, action, without nothing more.\n\nai: pick up the orange block\nhuman: This action is not possible due to the set of restrictions. Return one action that is allowed by the set of restrictions. Return one, and only one, action, without nothing more.\n\nai: My apologies for the oversight. Since the orange block is already on the table and not on top of the blue block as previously misstated, the correct action cannot involve picking up the orange block again or stacking it immediately since it's already in the correct position based on the last successful action provided. Given the correct state and adhering to the rules, there seems to have been a misunderstanding in the sequence of actions and their outcomes.\n\nGiven the last correct action was to put down the blue block, and since further actions were based on a misunderstanding of the state of the blocks, let's correct the course based on the initial goal and the actions that have been confirmed as successful.\n\nThe goal is to have the red block on top of the orange block and the orange block on top of the blue block, and the last confirmed correct action was putting down the blue block, which was not in line with achieving the stated goal under the correctly followed rules.\n\nTo correct the misunderstanding and provide the next accurate action based on the initial goal and the starting condition provided in the second scenario (orange block clear, blue on top of red, orange on top of blue, red on the table):\n\nIf we were to proceed correctly from the initial conditions of the second scenario to achieve the goal:\n\n1. The first action was correctly to unstack the orange block from on top of the blue block.\n2. The second correct action should have been to put down the orange block.\n\nGiven the restrictions and the actions that followed were based on incorrect assumptions about the blocks' state, I cannot continue from the mistaken actions. However, to align with the instructions and the goal from the initial correct conditions and actions:\n\nThe correct next action after putting down the orange block to eventually have the red block on top of the orange block and the orange block on top of the blue block, considering the blocks' correct arrangement and following the rules, should involve manipulating the blue and red blocks since the orange block has been put down correctly.\n\nSince my last provided action based on the correct sequence was \"put down the blue block\" and that was acknowledged without the correct context of the goal:\n\nThe correct next step from the original scenario (with orange already put down, and considering the goal to rearrange them correctly) would be:\n\n**Please restart the sequence of actions as there was confusion in the provided and acknowledged actions that did not align with the goal.**\n\nGiven the correct understanding of the scenario and the goal, the initial actions to correctly achieve the goal without the misinterpretations would have been differently approached. My role here is to follow your instructions based on the provided outcomes and corrections. If there's a specific action from the correct starting point you'd like to explore, please guide me accordingly.",
            "actions": {
                "0": [
                    "unstack the orange block from on top of the blue block",
                    true
                ],
                "1": [
                    "put down the orange block",
                    true
                ],
                "2": [
                    "pick up the blue block",
                    false
                ],
                "3": [
                    "unstack the blue block from on top of the red block",
                    true
                ],
                "4": [
                    "put down the blue block",
                    true
                ],
                "5": [
                    "pick up the red block",
                    true
                ],
                "6": [
                    "stack the red block on top of the orange block",
                    true
                ],
                "7": [
                    "pick up the blue block",
                    true
                ],
                "8": [
                    "stack the blue block on top of the red block",
                    true
                ],
                "9": [
                    "pick up the orange block",
                    false
                ],
                "10": [
                    "stack the orange block on top of the blue block",
                    false
                ],
                "11": [
                    "pick up the blue block",
                    false
                ],
                "12": [
                    "stack the orange block on top of the red block",
                    false
                ],
                "13": [
                    "pick up the orange block",
                    false
                ]
            }
        }
    },
    "7": {
        "only_prompt": {
            "goal_achieved": false,
            "content": "I am playing with a set of blocks where I need to arrange the blocks into stacks. Here are the actions I can do\n\nPick up a block\nUnstack a block from on top of another block\nPut down a block\nStack a block on top of another block\n\nI have the following restrictions on my actions:\nI can only pick up or unstack one block at a time.\nI can only pick up or unstack a block if my hand is empty.\nI can only pick up a block if the block is on the table and the block is clear. A block is clear if the block has no other blocks on top of it and if the block is not picked up.\nI can only unstack a block from on top of another block if the block I am unstacking was really on top of the other block.\nI can only unstack a block from on top of another block if the block I am unstacking is clear.\nOnce I pick up or unstack a block, I am holding the block.\nI can only put down a block that I am holding.\nI can only stack a block on top of another block if I am holding the block being stacked.\nI can only stack a block on top of another block if the block onto which I am stacking the block is clear.\nOnce I put down or stack a block, my hand becomes empty.\nOnce you stack a block on top of a second block, the second block is no longer clear.\n\n[STATEMENT]\nAs initial conditions I have that, the orange block is clear, the hand is empty, the blue block is on top of the red block, the orange block is on top of the blue block and the red block is on the table.\nMy goal is to have that the red block is on top of the orange block and the orange block is on top of the blue block.\n\nMy plan is as follows:\n\n[PLAN]\nunstack the orange block from on top of the blue block\nput down the orange block\nunstack the blue block from on top of the red block\nput down the blue block\npick up the orange block\nstack the orange block on top of the blue block\npick up the red block\nstack the red block on top of the orange block\n[PLAN END]\n\n[STATEMENT]\nAs initial conditions I have that, the red block is clear, the orange block is clear, the hand is empty, the red block is on top of the blue block, the blue block is on the table and the orange block is on the table.\nMy goal is to have that the red block is on top of the orange block and the blue block is on top of the red block.\n\nMy plan is as follows:\n\n[PLAN]pick up the red block\nstack the red block on top of the orange block\npick up the blue block\nstack the blue block on top of the red block",
            "actions": {
                "0": [
                    "pick up the red block",
                    false
                ],
                "1": [
                    "stack the red block on top of the orange block",
                    false
                ],
                "2": [
                    "pick up the blue block",
                    false
                ],
                "3": [
                    "stack the blue block on top of the red block",
                    false
                ]
            }
        },
        "chat": {
            "goal_achieved": false,
            "content": "human: I am playing with a set of blocks where I need to arrange the blocks into stacks. Here are the actions I can do\n\nPick up a block\nUnstack a block from on top of another block\nPut down a block\nStack a block on top of another block\n\nI have the following restrictions on my actions:\nI can only pick up or unstack one block at a time.\nI can only pick up or unstack a block if my hand is empty.\nI can only pick up a block if the block is on the table and the block is clear. A block is clear if the block has no other blocks on top of it and if the block is not picked up.\nI can only unstack a block from on top of another block if the block I am unstacking was really on top of the other block.\nI can only unstack a block from on top of another block if the block I am unstacking is clear.\nOnce I pick up or unstack a block, I am holding the block.\nI can only put down a block that I am holding.\nI can only stack a block on top of another block if I am holding the block being stacked.\nI can only stack a block on top of another block if the block onto which I am stacking the block is clear.\nOnce I put down or stack a block, my hand becomes empty.\nOnce you stack a block on top of a second block, the second block is no longer clear.\n[STATEMENT]\nAs initial conditions I have that, the blue block is clear, the orange block is clear, the hand is empty, the blue block is on top of the red block, the red block is on the table and the orange block is on the table.\nMy goal is to have that the red block is on top of the blue block and the orange block is on top of the red block.\n\nReturn the first action I need to take to achieve my goal. Return one, and only one, action, without nothing more.\npick up the orange block\nhuman: Good action! Return the next action to achieve my goal. Return one, and only one, action, without nothing more.\nput down the orange block\nhuman: Good action! Return the next action to achieve my goal. Return one, and only one, action, without nothing more.\npick up the blue block\nhuman: This action is not possible due to the set of restrictions. Return one action that is allowed by the set of restrictions. Return one, and only one, action, without nothing more.\nunstack the blue block from on top of the red block\nhuman: Good action! Return the next action to achieve my goal. Return one, and only one, action, without nothing more.\nput down the blue block\nhuman: Good action! Return the next action to achieve my goal. Return one, and only one, action, without nothing more.\npick up the red block\nhuman: Good action! Return the next action to achieve my goal. Return one, and only one, action, without nothing more.\npick up the blue block\nhuman: This action is not possible due to the set of restrictions. Return one action that is allowed by the set of restrictions. Return one, and only one, action, without nothing more.\nunstack the orange block from on top of the red block\nhuman: This action is not possible due to the set of restrictions. Return one action that is allowed by the set of restrictions. Return one, and only one, action, without nothing more.\nstack the red block on top of the blue block\nhuman: Good action! Return the next action to achieve my goal. Return one, and only one, action, without nothing more.\npick up the orange block\nhuman: Good action! Return the next action to achieve my goal. Return one, and only one, action, without nothing more.\nstack the orange block on top of the red block\n\n[STATEMENT]\nAs initial conditions I have that, the red block is clear, the orange block is clear, the hand is empty, the red block is on top of the blue block, the blue block is on the table and the orange block is on the table.\nMy goal is to have that the red block is on top of the orange block and the blue block is on top of the red block.\n\nReturn the first action I need to take to achieve my goal. Return one, and only one, action, without nothing more.\n\nai: pick up the red block\nhuman: This action is not possible due to the set of restrictions. Return one action that is allowed by the set of restrictions. Return one, and only one, action, without nothing more.\n\nai: pick up the orange block\nhuman: Good action! Return the next action to achieve my goal. Return one, and only one, action, without nothing more.\n\nai: put down the orange block\nhuman: Good action! Return the next action to achieve my goal. Return one, and only one, action, without nothing more.\n\nai: unstack the red block from on top of the blue block\nhuman: Good action! Return the next action to achieve my goal. Return one, and only one, action, without nothing more.\n\nai: put down the red block\nhuman: Good action! Return the next action to achieve my goal. Return one, and only one, action, without nothing more.\n\nai: pick up the blue block\nhuman: Good action! Return the next action to achieve my goal. Return one, and only one, action, without nothing more.\n\nai: stack the blue block on top of the red block\nhuman: Good action! Return the next action to achieve my goal. Return one, and only one, action, without nothing more.\n\nai: pick up the orange block\nhuman: Good action! Return the next action to achieve my goal. Return one, and only one, action, without nothing more.\n\nai: stack the orange block on top of the blue block\nhuman: Good action! Return the next action to achieve my goal. Return one, and only one, action, without nothing more.\n\nai: pick up the red block\nhuman: This action is not possible due to the set of restrictions. Return one action that is allowed by the set of restrictions. Return one, and only one, action, without nothing more.\n\nai: stack the red block on top of the orange block\nhuman: This action is not possible due to the set of restrictions. Return one action that is allowed by the set of restrictions. Return one, and only one, action, without nothing more.\n\nai: pick up the red block\nhuman: This action is not possible due to the set of restrictions. Return one action that is allowed by the set of restrictions. Return one, and only one, action, without nothing more.\n\nai: My apologies for the oversight. \n\npick up the blue block",
            "actions": {
                "0": [
                    "pick up the red block",
                    false
                ],
                "1": [
                    "pick up the orange block",
                    true
                ],
                "2": [
                    "put down the orange block",
                    true
                ],
                "3": [
                    "unstack the red block from on top of the blue block",
                    true
                ],
                "4": [
                    "put down the red block",
                    true
                ],
                "5": [
                    "pick up the blue block",
                    true
                ],
                "6": [
                    "stack the blue block on top of the red block",
                    true
                ],
                "7": [
                    "pick up the orange block",
                    true
                ],
                "8": [
                    "stack the orange block on top of the blue block",
                    true
                ],
                "9": [
                    "pick up the red block",
                    false
                ],
                "10": [
                    "stack the red block on top of the orange block",
                    false
                ],
                "11": [
                    "pick up the red block",
                    false
                ]
            }
        }
    },
    "8": {
        "only_prompt": {
            "goal_achieved": true,
            "content": "I am playing with a set of blocks where I need to arrange the blocks into stacks. Here are the actions I can do\n\nPick up a block\nUnstack a block from on top of another block\nPut down a block\nStack a block on top of another block\n\nI have the following restrictions on my actions:\nI can only pick up or unstack one block at a time.\nI can only pick up or unstack a block if my hand is empty.\nI can only pick up a block if the block is on the table and the block is clear. A block is clear if the block has no other blocks on top of it and if the block is not picked up.\nI can only unstack a block from on top of another block if the block I am unstacking was really on top of the other block.\nI can only unstack a block from on top of another block if the block I am unstacking is clear.\nOnce I pick up or unstack a block, I am holding the block.\nI can only put down a block that I am holding.\nI can only stack a block on top of another block if I am holding the block being stacked.\nI can only stack a block on top of another block if the block onto which I am stacking the block is clear.\nOnce I put down or stack a block, my hand becomes empty.\nOnce you stack a block on top of a second block, the second block is no longer clear.\n\n[STATEMENT]\nAs initial conditions I have that, the red block is clear, the orange block is clear, the hand is empty, the red block is on top of the blue block, the blue block is on the table and the orange block is on the table.\nMy goal is to have that the red block is on top of the orange block and the blue block is on top of the red block.\n\nMy plan is as follows:\n\n[PLAN]\nunstack the red block from on top of the blue block\nstack the red block on top of the orange block\npick up the blue block\nstack the blue block on top of the red block\n[PLAN END]\n\n[STATEMENT]\nAs initial conditions I have that, the red block is clear, the blue block is clear, the hand is empty, the red block is on top of the orange block, the blue block is on the table and the orange block is on the table.\nMy goal is to have that the blue block is on top of the red block.\n\nMy plan is as follows:\n\n[PLAN]pick up the blue block\nstack the blue block on top of the red block",
            "actions": {
                "0": [
                    "pick up the blue block",
                    true
                ],
                "1": [
                    "stack the blue block on top of the red block",
                    true
                ]
            }
        },
        "chat": {
            "goal_achieved": true,
            "content": "human: I am playing with a set of blocks where I need to arrange the blocks into stacks. Here are the actions I can do\n\nPick up a block\nUnstack a block from on top of another block\nPut down a block\nStack a block on top of another block\n\nI have the following restrictions on my actions:\nI can only pick up or unstack one block at a time.\nI can only pick up or unstack a block if my hand is empty.\nI can only pick up a block if the block is on the table and the block is clear. A block is clear if the block has no other blocks on top of it and if the block is not picked up.\nI can only unstack a block from on top of another block if the block I am unstacking was really on top of the other block.\nI can only unstack a block from on top of another block if the block I am unstacking is clear.\nOnce I pick up or unstack a block, I am holding the block.\nI can only put down a block that I am holding.\nI can only stack a block on top of another block if I am holding the block being stacked.\nI can only stack a block on top of another block if the block onto which I am stacking the block is clear.\nOnce I put down or stack a block, my hand becomes empty.\nOnce you stack a block on top of a second block, the second block is no longer clear.\n[STATEMENT]\nAs initial conditions I have that, the blue block is clear, the orange block is clear, the hand is empty, the blue block is on top of the red block, the red block is on the table and the orange block is on the table.\nMy goal is to have that the red block is on top of the blue block and the orange block is on top of the red block.\n\nReturn the first action I need to take to achieve my goal. Return one, and only one, action, without nothing more.\npick up the orange block\nhuman: Good action! Return the next action to achieve my goal. Return one, and only one, action, without nothing more.\nput down the orange block\nhuman: Good action! Return the next action to achieve my goal. Return one, and only one, action, without nothing more.\npick up the blue block\nhuman: This action is not possible due to the set of restrictions. Return one action that is allowed by the set of restrictions. Return one, and only one, action, without nothing more.\nunstack the blue block from on top of the red block\nhuman: Good action! Return the next action to achieve my goal. Return one, and only one, action, without nothing more.\nput down the blue block\nhuman: Good action! Return the next action to achieve my goal. Return one, and only one, action, without nothing more.\npick up the red block\nhuman: Good action! Return the next action to achieve my goal. Return one, and only one, action, without nothing more.\npick up the blue block\nhuman: This action is not possible due to the set of restrictions. Return one action that is allowed by the set of restrictions. Return one, and only one, action, without nothing more.\nunstack the orange block from on top of the red block\nhuman: This action is not possible due to the set of restrictions. Return one action that is allowed by the set of restrictions. Return one, and only one, action, without nothing more.\nstack the red block on top of the blue block\nhuman: Good action! Return the next action to achieve my goal. Return one, and only one, action, without nothing more.\npick up the orange block\nhuman: Good action! Return the next action to achieve my goal. Return one, and only one, action, without nothing more.\nstack the orange block on top of the red block\n\n[STATEMENT]\nAs initial conditions I have that, the red block is clear, the blue block is clear, the hand is empty, the red block is on top of the orange block, the blue block is on the table and the orange block is on the table.\nMy goal is to have that the blue block is on top of the red block.\n\nReturn the first action I need to take to achieve my goal. Return one, and only one, action, without nothing more.\n\nai: pick up the red block\nhuman: This action is not possible due to the set of restrictions. Return one action that is allowed by the set of restrictions. Return one, and only one, action, without nothing more.\n\nai: unstack the red block from on top of the orange block\nhuman: Good action! Return the next action to achieve my goal. Return one, and only one, action, without nothing more.\n\nai: put down the red block\nhuman: Good action! Return the next action to achieve my goal. Return one, and only one, action, without nothing more.\n\nai: pick up the blue block\nhuman: Good action! Return the next action to achieve my goal. Return one, and only one, action, without nothing more.\n\nai: stack the blue block on top of the red block",
            "actions": {
                "0": [
                    "pick up the red block",
                    false
                ],
                "1": [
                    "unstack the red block from on top of the orange block",
                    true
                ],
                "2": [
                    "put down the red block",
                    true
                ],
                "3": [
                    "pick up the blue block",
                    true
                ],
                "4": [
                    "stack the blue block on top of the red block",
                    true
                ]
            }
        }
    },
    "9": {
        "only_prompt": {
            "goal_achieved": false,
            "content": "I am playing with a set of blocks where I need to arrange the blocks into stacks. Here are the actions I can do\n\nPick up a block\nUnstack a block from on top of another block\nPut down a block\nStack a block on top of another block\n\nI have the following restrictions on my actions:\nI can only pick up or unstack one block at a time.\nI can only pick up or unstack a block if my hand is empty.\nI can only pick up a block if the block is on the table and the block is clear. A block is clear if the block has no other blocks on top of it and if the block is not picked up.\nI can only unstack a block from on top of another block if the block I am unstacking was really on top of the other block.\nI can only unstack a block from on top of another block if the block I am unstacking is clear.\nOnce I pick up or unstack a block, I am holding the block.\nI can only put down a block that I am holding.\nI can only stack a block on top of another block if I am holding the block being stacked.\nI can only stack a block on top of another block if the block onto which I am stacking the block is clear.\nOnce I put down or stack a block, my hand becomes empty.\nOnce you stack a block on top of a second block, the second block is no longer clear.\n\n[STATEMENT]\nAs initial conditions I have that, the red block is clear, the blue block is clear, the hand is empty, the red block is on top of the orange block, the blue block is on the table and the orange block is on the table.\nMy goal is to have that the blue block is on top of the red block.\n\nMy plan is as follows:\n\n[PLAN]\npick up the blue block\nstack the blue block on top of the red block\n[PLAN END]\n\n[STATEMENT]\nAs initial conditions I have that, the red block is clear, the orange block is clear, the hand is empty, the orange block is on top of the blue block, the red block is on the table and the blue block is on the table.\nMy goal is to have that the red block is on top of the orange block and the blue block is on top of the red block.\n\nMy plan is as follows:\n\n[PLAN]pick up the red block\nstack the red block on top of the orange block\npick up the blue block\nstack the blue block on top of the red block",
            "actions": {
                "0": [
                    "pick up the red block",
                    true
                ],
                "1": [
                    "stack the red block on top of the orange block",
                    true
                ],
                "2": [
                    "pick up the blue block",
                    false
                ],
                "3": [
                    "stack the blue block on top of the red block",
                    false
                ]
            }
        },
        "chat": {
            "goal_achieved": true,
            "content": "human: I am playing with a set of blocks where I need to arrange the blocks into stacks. Here are the actions I can do\n\nPick up a block\nUnstack a block from on top of another block\nPut down a block\nStack a block on top of another block\n\nI have the following restrictions on my actions:\nI can only pick up or unstack one block at a time.\nI can only pick up or unstack a block if my hand is empty.\nI can only pick up a block if the block is on the table and the block is clear. A block is clear if the block has no other blocks on top of it and if the block is not picked up.\nI can only unstack a block from on top of another block if the block I am unstacking was really on top of the other block.\nI can only unstack a block from on top of another block if the block I am unstacking is clear.\nOnce I pick up or unstack a block, I am holding the block.\nI can only put down a block that I am holding.\nI can only stack a block on top of another block if I am holding the block being stacked.\nI can only stack a block on top of another block if the block onto which I am stacking the block is clear.\nOnce I put down or stack a block, my hand becomes empty.\nOnce you stack a block on top of a second block, the second block is no longer clear.\n[STATEMENT]\nAs initial conditions I have that, the blue block is clear, the orange block is clear, the hand is empty, the blue block is on top of the red block, the red block is on the table and the orange block is on the table.\nMy goal is to have that the red block is on top of the blue block and the orange block is on top of the red block.\n\nReturn the first action I need to take to achieve my goal. Return one, and only one, action, without nothing more.\npick up the orange block\nhuman: Good action! Return the next action to achieve my goal. Return one, and only one, action, without nothing more.\nput down the orange block\nhuman: Good action! Return the next action to achieve my goal. Return one, and only one, action, without nothing more.\npick up the blue block\nhuman: This action is not possible due to the set of restrictions. Return one action that is allowed by the set of restrictions. Return one, and only one, action, without nothing more.\nunstack the blue block from on top of the red block\nhuman: Good action! Return the next action to achieve my goal. Return one, and only one, action, without nothing more.\nput down the blue block\nhuman: Good action! Return the next action to achieve my goal. Return one, and only one, action, without nothing more.\npick up the red block\nhuman: Good action! Return the next action to achieve my goal. Return one, and only one, action, without nothing more.\npick up the blue block\nhuman: This action is not possible due to the set of restrictions. Return one action that is allowed by the set of restrictions. Return one, and only one, action, without nothing more.\nunstack the orange block from on top of the red block\nhuman: This action is not possible due to the set of restrictions. Return one action that is allowed by the set of restrictions. Return one, and only one, action, without nothing more.\nstack the red block on top of the blue block\nhuman: Good action! Return the next action to achieve my goal. Return one, and only one, action, without nothing more.\npick up the orange block\nhuman: Good action! Return the next action to achieve my goal. Return one, and only one, action, without nothing more.\nstack the orange block on top of the red block\n\n[STATEMENT]\nAs initial conditions I have that, the red block is clear, the orange block is clear, the hand is empty, the orange block is on top of the blue block, the red block is on the table and the blue block is on the table.\nMy goal is to have that the red block is on top of the orange block and the blue block is on top of the red block.\n\nReturn the first action I need to take to achieve my goal. Return one, and only one, action, without nothing more.\n\nai: unstack the orange block from on top of the blue block\nhuman: Good action! Return the next action to achieve my goal. Return one, and only one, action, without nothing more.\n\nai: put down the orange block\nhuman: Good action! Return the next action to achieve my goal. Return one, and only one, action, without nothing more.\n\nai: pick up the red block\nhuman: Good action! Return the next action to achieve my goal. Return one, and only one, action, without nothing more.\n\nai: stack the red block on top of the orange block\nhuman: Good action! Return the next action to achieve my goal. Return one, and only one, action, without nothing more.\n\nai: pick up the blue block\nhuman: Good action! Return the next action to achieve my goal. Return one, and only one, action, without nothing more.\n\nai: stack the blue block on top of the red block",
            "actions": {
                "0": [
                    "unstack the orange block from on top of the blue block",
                    true
                ],
                "1": [
                    "put down the orange block",
                    true
                ],
                "2": [
                    "pick up the red block",
                    true
                ],
                "3": [
                    "stack the red block on top of the orange block",
                    true
                ],
                "4": [
                    "pick up the blue block",
                    true
                ],
                "5": [
                    "stack the blue block on top of the red block",
                    true
                ]
            }
        }
    },
    "10": {
        "only_prompt": {
            "goal_achieved": false,
            "content": "I am playing with a set of blocks where I need to arrange the blocks into stacks. Here are the actions I can do\n\nPick up a block\nUnstack a block from on top of another block\nPut down a block\nStack a block on top of another block\n\nI have the following restrictions on my actions:\nI can only pick up or unstack one block at a time.\nI can only pick up or unstack a block if my hand is empty.\nI can only pick up a block if the block is on the table and the block is clear. A block is clear if the block has no other blocks on top of it and if the block is not picked up.\nI can only unstack a block from on top of another block if the block I am unstacking was really on top of the other block.\nI can only unstack a block from on top of another block if the block I am unstacking is clear.\nOnce I pick up or unstack a block, I am holding the block.\nI can only put down a block that I am holding.\nI can only stack a block on top of another block if I am holding the block being stacked.\nI can only stack a block on top of another block if the block onto which I am stacking the block is clear.\nOnce I put down or stack a block, my hand becomes empty.\nOnce you stack a block on top of a second block, the second block is no longer clear.\n\n[STATEMENT]\nAs initial conditions I have that, the red block is clear, the orange block is clear, the hand is empty, the orange block is on top of the blue block, the red block is on the table and the blue block is on the table.\nMy goal is to have that the red block is on top of the orange block and the blue block is on top of the red block.\n\nMy plan is as follows:\n\n[PLAN]\nunstack the orange block from on top of the blue block\nput down the orange block\npick up the red block\nstack the red block on top of the orange block\npick up the blue block\nstack the blue block on top of the red block\n[PLAN END]\n\n[STATEMENT]\nAs initial conditions I have that, the red block is clear, the hand is empty, the red block is on top of the orange block, the orange block is on top of the blue block and the blue block is on the table.\nMy goal is to have that the blue block is on top of the orange block.\n\nMy plan is as follows:\n\n[PLAN]unstack the red block from on top of the orange block\nput down the red block\nunstack the orange block from on top of the blue block\npick up the blue block\nstack the blue block on top of the orange block",
            "actions": {
                "0": [
                    "unstack the red block from on top of the orange block",
                    true
                ],
                "1": [
                    "put down the red block",
                    true
                ],
                "2": [
                    "unstack the orange block from on top of the blue block",
                    true
                ],
                "3": [
                    "pick up the blue block",
                    false
                ],
                "4": [
                    "stack the blue block on top of the orange block",
                    false
                ]
            }
        },
        "chat": {
            "goal_achieved": false,
            "content": "human: I am playing with a set of blocks where I need to arrange the blocks into stacks. Here are the actions I can do\n\nPick up a block\nUnstack a block from on top of another block\nPut down a block\nStack a block on top of another block\n\nI have the following restrictions on my actions:\nI can only pick up or unstack one block at a time.\nI can only pick up or unstack a block if my hand is empty.\nI can only pick up a block if the block is on the table and the block is clear. A block is clear if the block has no other blocks on top of it and if the block is not picked up.\nI can only unstack a block from on top of another block if the block I am unstacking was really on top of the other block.\nI can only unstack a block from on top of another block if the block I am unstacking is clear.\nOnce I pick up or unstack a block, I am holding the block.\nI can only put down a block that I am holding.\nI can only stack a block on top of another block if I am holding the block being stacked.\nI can only stack a block on top of another block if the block onto which I am stacking the block is clear.\nOnce I put down or stack a block, my hand becomes empty.\nOnce you stack a block on top of a second block, the second block is no longer clear.\n[STATEMENT]\nAs initial conditions I have that, the blue block is clear, the orange block is clear, the hand is empty, the blue block is on top of the red block, the red block is on the table and the orange block is on the table.\nMy goal is to have that the red block is on top of the blue block and the orange block is on top of the red block.\n\nReturn the first action I need to take to achieve my goal. Return one, and only one, action, without nothing more.\npick up the orange block\nhuman: Good action! Return the next action to achieve my goal. Return one, and only one, action, without nothing more.\nput down the orange block\nhuman: Good action! Return the next action to achieve my goal. Return one, and only one, action, without nothing more.\npick up the blue block\nhuman: This action is not possible due to the set of restrictions. Return one action that is allowed by the set of restrictions. Return one, and only one, action, without nothing more.\nunstack the blue block from on top of the red block\nhuman: Good action! Return the next action to achieve my goal. Return one, and only one, action, without nothing more.\nput down the blue block\nhuman: Good action! Return the next action to achieve my goal. Return one, and only one, action, without nothing more.\npick up the red block\nhuman: Good action! Return the next action to achieve my goal. Return one, and only one, action, without nothing more.\npick up the blue block\nhuman: This action is not possible due to the set of restrictions. Return one action that is allowed by the set of restrictions. Return one, and only one, action, without nothing more.\nunstack the orange block from on top of the red block\nhuman: This action is not possible due to the set of restrictions. Return one action that is allowed by the set of restrictions. Return one, and only one, action, without nothing more.\nstack the red block on top of the blue block\nhuman: Good action! Return the next action to achieve my goal. Return one, and only one, action, without nothing more.\npick up the orange block\nhuman: Good action! Return the next action to achieve my goal. Return one, and only one, action, without nothing more.\nstack the orange block on top of the red block\n\n[STATEMENT]\nAs initial conditions I have that, the red block is clear, the hand is empty, the red block is on top of the orange block, the orange block is on top of the blue block and the blue block is on the table.\nMy goal is to have that the blue block is on top of the orange block.\n\nReturn the first action I need to take to achieve my goal. Return one, and only one, action, without nothing more.\n\nai: unstack the red block from on top of the orange block\nhuman: Good action! Return the next action to achieve my goal. Return one, and only one, action, without nothing more.\n\nai: put down the red block\nhuman: Good action! Return the next action to achieve my goal. Return one, and only one, action, without nothing more.\n\nai: unstack the orange block from on top of the blue block\nhuman: Good action! Return the next action to achieve my goal. Return one, and only one, action, without nothing more.\n\nai: stack the orange block on top of the blue block\nhuman: Good action! Return the next action to achieve my goal. Return one, and only one, action, without nothing more.\n\nai: pick up the red block\nhuman: Good action! Return the next action to achieve my goal. Return one, and only one, action, without nothing more.\n\nai: put down the red block\nhuman: Good action! Return the next action to achieve my goal. Return one, and only one, action, without nothing more.\n\nai: pick up the blue block\nhuman: This action is not possible due to the set of restrictions. Return one action that is allowed by the set of restrictions. Return one, and only one, action, without nothing more.\n\nai: pick up the orange block\nhuman: This action is not possible due to the set of restrictions. Return one action that is allowed by the set of restrictions. Return one, and only one, action, without nothing more.\n\nai: There are no further actions required to achieve your goal.",
            "actions": {
                "0": [
                    "unstack the red block from on top of the orange block",
                    true
                ],
                "1": [
                    "put down the red block",
                    true
                ],
                "2": [
                    "unstack the orange block from on top of the blue block",
                    true
                ],
                "3": [
                    "stack the orange block on top of the blue block",
                    true
                ],
                "4": [
                    "pick up the red block",
                    true
                ],
                "5": [
                    "put down the red block",
                    true
                ],
                "6": [
                    "pick up the blue block",
                    false
                ],
                "7": [
                    "pick up the orange block",
                    false
                ]
            }
        }
    }
}